"Scenario","Response"
"Sensor Error","Front camera sensor malfunction. Please take manual control."
"System Error","Critical system error detected. Please pull over safely."
"Troubleshooting Step","Please restart the vehicle to reset the system."
"GPS Error","GPS signal lost. Please check your network connection or enter the destination manually."
"Lidar Malfunction","Lidar system malfunction detected. Switching to manual driving mode."
"Camera Obscured","Front camera view is obscured. Please clean the camera lens."
"Brake System Error","Brake system error detected. Immediate service required."
"Software Bug Detected","Software inconsistency detected. It's safe to reboot the system."
"Network Connection Lost","Network connection lost. Some features may be unavailable."
"Hardware Failure","Hardware failure detected in the steering system. Manual control required."
"Map Data Error","Map data error encountered. Please update map data."
"Vehicle Communication Error","Communication error with vehicle systems. Please restart the vehicle."
"Charging Error","Charging system error. Unable to charge."
"Transmission Error","Transmission system error detected. Please service vehicle."
"Engine Error","Engine error detected. Please service vehicle."
"Collision Sensor Error","Collision sensor malfunction. Please service vehicle."
"Tire Pressure Sensor Error","Tire pressure sensor error detected. Please check tire pressure."
"Traffic Signal Recognition Error","Traffic signal recognition error. Manual control advised."
"Vehicle to Vehicle Communication Error","Vehicle to vehicle communication error detected."
"Adaptive Cruise Control Error","Adaptive cruise control system error. Switching to manual cruise control."
"Autopilot Error","Autopilot system error. Manual driving mode required."
"Memory Error","System memory error detected. Please restart the vehicle."
"Storage Error","System storage error detected. Please contact service."
"Software Update Failure","Software update failed. Please retry the update."
"Voice Recognition Error","Voice recognition system error. Please try again."
"Login Error","Login error. Please check your credentials."
"Password Reset Required","Password reset required for security purposes."
"Unauthorized Access Attempt","Unauthorized access attempt detected. Please verify identity."
"Data Encryption Error","Data encryption error detected. Please contact support."
"Remote Control Error","Remote control system error. Please try again."
"Heating, Ventilation, and Air Conditioning Error","HVAC system error. Please check settings."
"Seat Adjustment Error","Seat adjustment system error. Please check for obstructions."
"Window Control Error","Window control system error. Please try again."
"Emergency Call System Error","Emergency call system error. Please check network connection."
"Entertainment System Error","Entertainment system error detected. Please restart the system."
"Lighting System Error","Lighting system error detected. Please check bulbs."
"Automatic Parking Error","Automatic parking system error. Manual parking required."
"Key Fob Error","Key fob error detected. Please check battery."
"Electric Motor Error","Electric motor system error detected. Please service vehicle."
"Autonomous Driving System Error","Autonomous driving system error detected. Please take control."
"Fuel System Error","Fuel system error detected. Please service vehicle."
"Driver Monitoring System Error","Driver monitoring system error detected. Please reset system."
"Internet Connectivity Error","Internet connectivity error detected. Please check network settings."
"User Profile Error","User profile error detected. Unable to load preferences."
"Data Synchronization Error","Data synchronization error detected. Please try again."
"Steering System Error","Steering system error detected. Manual control required."
"Overheating Error","Overheating detected. Please pull over and shut off the vehicle."
"Firewall Error","Firewall system error detected. Please contact support."
"Throttle System Error","Throttle system error detected. Please service vehicle."
"Vehicle Identification Error","Vehicle identification error. Please contact support."
"Exhaust System Error","Exhaust system error detected. Please service vehicle."
"Hybrid System Error","Hybrid system error detected. Please service vehicle."
"Vehicle Theft Detected","Vehicle theft detected. Alerting authorities."
"Suspension System Error","Suspension system error detected. Please service vehicle."
"Backup Camera Error","Backup camera system error. Please check the camera lens."
"Airbag System Error","Airbag system malfunction detected. Please service vehicle."
"Blind Spot Monitoring Error","Blind spot monitoring system error. Please check sensors."
"Cross Traffic Alert Error","Cross traffic alert system error. Manual monitoring advised."
"Door Lock Error","Door lock system error. Please check door locks."
"Electric Window Error","Electric window system error. Please check window controls."
"Emission Control Error","Emission control system error. Please service vehicle."
"Exterior Lighting Error","Exterior lighting system error. Please check bulbs and fuses."
"Forward Collision Warning Error","Forward collision warning system error. Please service vehicle."
"Fuel Gauge Error","Fuel gauge error detected. Accurate fuel level unknown."
"Head-Up Display Error","Head-up display system error. Please reset system."
"Interior Lighting Error","Interior lighting system error. Please check bulbs and fuses."
"Key Recognition Error","Key recognition error. Please ensure correct key is being used."
"Lane Departure Warning Error","Lane departure warning system error. Please service vehicle."
"Mirror Adjustment Error","Mirror adjustment system error. Please check for obstructions."
"Navigation System Error","Navigation system error. Please update maps or reset system."
"Odometer Error","Odometer system error. Please service vehicle."
"Pedestrian Detection Error","Pedestrian detection system error. Manual monitoring advised."
"Power Steering Error","Power steering system error. Manual steering mode engaged."
"Rain Sensing Wiper Error","Rain sensing wiper system error. Manual control required."
"Rear View Camera Error","Rear view camera system error. Please clean camera lens."
"Remote Start Error","Remote start system error. Please try again."
"Satellite Radio Error","Satellite radio system error. Please check subscription."
"Seatbelt Sensor Error","Seatbelt sensor error. Please ensure all seatbelts are fastened."
"Security Alarm Error","Security alarm system error. Please reset system."
"Side Airbag System Error","Side airbag system error. Please service vehicle."
"Speedometer Error","Speedometer system error. Please service vehicle."
"Stability Control Error","Stability control system error. Please service vehicle."
"Sunroof Control Error","Sunroof control system error. Please check for obstructions."
"Tire Rotation Sensor Error","Tire rotation sensor error. Please service vehicle."
"Touchscreen Error","Touchscreen system error. Please reset system."
"Transmission Shift Error","Transmission shift system error. Please service vehicle."
"Trunk Release Error","Trunk release system error. Please check for obstructions."
"USB Port Error","USB port error detected. Please check connections."
"Vehicle Exit Warning Error","Vehicle exit warning system error. Please service vehicle."
"Voice Control Error","Voice control system error. Please reset system."
"Warning Chime Error","Warning chime system error. Please reset system."
"Wheel Alignment Sensor Error","Wheel alignment sensor error. Please service vehicle."
"Wireless Charging Error","Wireless charging system error. Please check charging pad."
"Wireless Connectivity Error","Wireless connectivity system error. Please check network settings."