"Scenario","Response"
"Adjust Cabin Lighting","Adjusting cabin lighting to your preference."
"Massage Seat Activation","Activating massage function on the driver's seat."
"Quiet Mode Activation","Quiet mode activated. All notifications will be minimized."
"Temperature Adjustment","Setting cabin temperature to 72 degrees Fahrenheit."
"Seat Heating Activation","Activating seat heating for front seats."
"Seat Ventilation Activation","Activating seat ventilation for front seats."
"Infotainment Volume Adjustment","Adjusting volume to medium level."
"Play Calming Music","Playing calming music playlist."
"Play Energizing Music","Playing energizing music playlist."
"Window Tint Adjustment","Adjusting window tint for privacy."
"Change Ambient Lighting","Changing ambient lighting to a soothing blue."
"Activate Relaxation Mode","Relaxation mode activated. Enjoy a peaceful ride."
"Activate Productivity Mode","Productivity mode activated. Wi-Fi enabled."
"Enable Wi-Fi","Wi-Fi enabled. Network name: Car_Network."
"Disable Wi-Fi","Wi-Fi disabled."
"Play Podcast","Playing latest episode of 'Car Talk' podcast."
"Play Audiobook","Playing 'The Great Gatsby' audiobook."
"Play News","Playing today's news headlines."
"Play Sports Update","Playing latest sports updates."
"Play Weather Update","Playing weather update for the day."
"Adjust Seat Position","Adjusting seat to saved position."
"Adjust Steering Wheel Position","Adjusting steering wheel to saved position."
"Adjust Mirror Position","Adjusting mirrors to saved position."
"Activate Sleep Mode","Sleep mode activated. Reclining seats."
"Activate Work Mode","Work mode activated. Deploying table."
"Request Privacy","Privacy mode activated. Windows tinted, noise cancellation enabled."
"Request Open Sky View","Opening sunroof for sky view."
"Request Star Gazing Mode","Star gazing mode activated. Reclining seats, opening sunroof."
"Adjust Fragrance Dispenser","Adjusting fragrance dispenser to 'Lavender Bliss'."
"Enable Air Purification","Air purification system activated."
"Enable Humidifier","Cabin humidifier activated."
"Enable Dehumidifier","Cabin dehumidifier activated."
"Request Beverage","Beverage dispenser activated. Dispensing coffee."
"Request Snack","Snack dispenser activated. Dispensing chips."
"Enable Gaming Mode","Gaming mode activated. Enjoy your game!"
"Enable Movie Mode","Movie mode activated. Playing 'Inception'."
"Enable Reading Mode","Reading mode activated. Adjustable lighting enabled."
"Enable Meditation Mode","Meditation mode activated. Playing soothing sounds."
"Enable Fitness Mode","Fitness mode activated. Seat adjusted for workout."
"Enable Social Mode","Social mode activated. Connecting to social platforms."
"Enable Virtual Reality Mode","Virtual reality mode activated. Please put on your VR headset."
"Enable Augmented Reality Mode","Augmented reality mode activated. Enjoy the experience!"
"Enable Learning Mode","Learning mode activated. What would you like to learn today?"
"Enable Live Concert Mode","Live concert mode activated. Streaming live concert now."
"Enable Theater Mode","Theater mode activated. Enjoy the show!"
"Enable Disco Mode","Disco mode activated. Let's have some fun!"
"Enable Karaoke Mode","Karaoke mode activated. Ready to sing?"
"Enable Storytelling Mode","Storytelling mode activated. Ready for a bedtime story?"
"Enable Adventure Mode","Adventure mode activated. Hold tight!"
"Enable Chill Mode","Chill mode activated. Relax and enjoy your ride."
"Enable Sports Viewing Mode","Sports viewing mode activated. Streaming live game now."
"Enable News Briefing Mode","News briefing mode activated. Here are today's headlines."
"Enable Family Mode","Family mode activated. Enjoy the ride with your family!"
"Enable Friends Mode","Friends mode activated. Share the joy with your friends!"
"Enable Business Mode","Business mode activated. Ready for a productive ride?"
"Enable Leisure Mode","Leisure mode activated. Enjoy your free time."